{
    "code": "PRG",
    "name": "VÃ¡clav Havel Airport Prague",
    "employment": [{
        "year": "2019",
        "value": 2925
    },{
        "year": "2020",
        "value": 2345
    },{
        "year": "2021",
        "value": 1745
    }],
    "departures": [{
        "number": "XY1234",
        "time": "2022-07-07T15:40:00",
        "to": {
            "code": "DUB",
            "name": "Dublin Airport"
        }
    },{
        "number": "YZ8745",
        "to": {
            "code": "DUB",
            "name": "Dublin Airport"
        }
    }],
    "arrivals": [{
        "number": "AB9874",
        "time": "2022-07-07T12:14:00",
        "from": {
            "code": "DUB",
            "name": "Dublin Airport"
        }
    }]
}